{
  "$schema": "https://json-schema.org/draft/2020-12/schema",
  "$id": "https://schemas.example.internal/homelabnext/status/agent_activity/1.0",
  "title": "Agent activity event (summary tier)",
  "description": "One normalized event of an agent session, from any runtime (a coding CLI on a workstation or in the cloud, an orchestrator, a generic pusher): the public summary tier of the status hub's agent activity (ADR-0013 stage 1b, docs/status.md). It names things and counts things; it never carries a prompt, a command, a tool input or output or an approval payload -- those live only in the private detail tier (agent_activity_detail.schema.json), which never goes on the shared bus. It is also the data of the homelabnext.agent.activity event. Evolve additively.",
  "type": "object",
  "additionalProperties": false,
  "required": ["event_id", "session_id", "runtime", "time", "kind"],
  "properties": {
    "event_id": {"$ref": "#/$defs/id", "description": "Unique per event; a re-sent event is a duplicate."},
    "session_id": {"$ref": "#/$defs/id"},
    "parent_session_id": {"$ref": "#/$defs/id", "description": "The session that started this one (a subagent, a delegated task)."},
    "runtime": {"type": "string", "pattern": "^[a-z][a-z0-9-]{0,31}$(?!\\n)", "description": "What runs the agent: claude-code, codex, hermes, orchestrator, agentmetry, generic, ..."},
    "surface": {"enum": ["local", "cloud"], "description": "Where the session runs: a lab or workstation host, or a cloud session."},
    "host": {"type": "string", "pattern": "^[A-Za-z0-9][A-Za-z0-9._-]{0,62}$(?!\\n)"},
    "project": {"type": "string", "pattern": "^[A-Za-z0-9][A-Za-z0-9._@-]{0,62}$(?!\\n)", "description": "The project or repository name (never a path)."},
    "model": {"type": "string", "pattern": "^[A-Za-z0-9][A-Za-z0-9._:/@-]{0,99}$(?!\\n)"},
    "agent": {"type": "string", "pattern": "^[A-Za-z0-9][A-Za-z0-9._:-]{0,63}$(?!\\n)", "description": "The agent or profile name."},
    "time": {"$ref": "https://schemas.example.internal/homelabnext/ids/common/1.0#/$defs/timestamp"},
    "kind": {
      "enum": ["session_start", "session_end", "prompt", "tool_start", "tool_end", "approval_request", "approval_response", "notification", "stop", "subagent_stop", "error", "heartbeat", "usage"],
      "description": "stop: the agent finished its turn and waits for the operator; session_end: the session is over."
    },
    "tool": {"type": "string", "pattern": "^[A-Za-z0-9][A-Za-z0-9._:/-]{0,127}$(?!\\n)", "description": "The tool's NAME only, never its input."},
    "outcome": {"enum": ["success", "error", "denied", "pending", "approved", "info"]},
    "tokens_in": {"type": "integer", "minimum": 0, "maximum": 10000000000},
    "tokens_out": {"type": "integer", "minimum": 0, "maximum": 10000000000},
    "cost_usd": {"type": "number", "minimum": 0, "maximum": 1000000, "description": "Only when the runtime reports it."},
    "has_detail": {"type": "boolean", "description": "A private detail record exists for this event."}
  },
  "$defs": {
    "id": {"type": "string", "pattern": "^[A-Za-z0-9][A-Za-z0-9._:-]{0,127}$(?!\\n)"}
  }
}
