{
  "event_id": "cc-6b1f0c2e-0007",
  "session_id": "6b1f0c2e-4d7a-4c55-9e0b-2f6d8a1c3e10",
  "runtime": "claude-code",
  "surface": "local",
  "host": "devbox",
  "project": "homelab-next",
  "model": "example-model-large",
  "time": "2026-10-20T08:00:05Z",
  "kind": "tool_end",
  "tool": "Bash",
  "outcome": "success",
  "has_detail": true
}
